{
  "$schema": "https://gbr-protocol.dev/schemas/v0/scene-card.schema.json",
  "scene_id": "conformance-minimal-s01",
  "book_id": "conformance-test-minimal",
  "chapter": 1,

  "observables": {
    "focalizer": "protagonist"
  },

  "structure": {
    "beat": "inciting_incident",
    "canonical_summary": {
      "want": "protagonist wants to understand what happened",
      "outcome": "failed",
      "delta": "The protagonist's world has changed; they do not yet know how to proceed.",
      "scene_turns": [
        {
          "observables": {
            "turn_number": 1,
            "active_character": "protagonist",
            "verb": "discovers",
            "target": "an unexpected change",
            "event_type": "action"
          },
          "interpretations": {
            "result": "the situation is irrevocably altered"
          }
        }
      ]
    }
  },

  "interpretations": {
    "pov": "third_limited"
  }
}
